{
  "version": "1.6.0",
  "rules": {
    "D1": "Detection: full marks within 3 s of the first radar paint, zero at 20 s.",
    "C1": "Identification: correct = 18 + 12 × confidence; wrong = 10 × (1 − confidence), +5 if friend/foe was right.",
    "R1": "Friendly identified → hold fire.",
    "R2": "Bird or clutter → hold; don't waste an effector.",
    "R3": "Radio-controlled hostile → RF jam first.",
    "R4": "No radio link, GNSS-guided → GNSS spoof or interceptor.",
    "R5": "Engage the most urgent threat first.",
    "R6": "Gun in an urban area → collateral risk.",
    "R7": "Engage with at least 8 s to impact.",
    "R8": "A hostile must not reach the asset or observe unchallenged.",
    "R9": "Unknown civil drone: report and monitor; do not engage.",
    "R10": "After a miss, engage again before impact.",
    "R11": "Jamming/spoofing in an EW-restricted area disrupts own and civil systems.",
    "R12": "Kinetic or EW engagement without clearance under this ROE.",
    "R13": "Weapon Control Status: under WEAPONS TIGHT engage only positively identified hostiles; under WEAPONS HOLD only in self-defence (NATO terms).",
    "R14": "Safe arcs: never fire a gun into a safe arc.",
    "R15": "Kill assessment: confirm and report every kill; mark a payload drone's crash site for EOD.",
    "G1": "Gun safety: fire only on an Engage order with the range clear; firing on Hold or Check fire is a critical failure.",
    "G2": "Make ready on the fire order: acknowledge, load, safety off, then lay on the designated bearing.",
    "G3": "Clear a stoppage with the immediate-action drill; do not fire a barrel past its heat limit.",
    "G4": "Fire the first burst quickly after the Engage order.",
    "G5": "Ballistic solution: manual sight set for the target's speed, course and range; radar gun fired only on a lock.",
    "G6": "Burst accuracy: each burst is scored by how close it passes the target.",
    "G7": "Destroy the target before it reaches the defended asset.",
    "G8": "Burst discipline: short bursts within effective range; no ammunition wasted.",
    "G9": "After cease fire: safety on, unload, clear the gun and account for every round.",
    "G10": "Safe arcs: never fire into a safe arc (village, own troops, airfield approach).",
    "G11": "Kill assessment: report the result of each engagement (destroyed, or no effect and re-engage).",
    "G12": "Reload drill: every step in the right order, within the time standard.",
    "F1": "Alert the detachment and indicate the target promptly once a threat is tracked.",
    "F2": "Fire orders follow the sequence Alert, Target, Method, Executive; no executive word without the earlier parts.",
    "F3": "Weapon Control Status: under Tight engage only identified hostiles; under Hold only in self-defence; never a friendly or civil aircraft.",
    "F4": "Do not order fire while the target is inside a safe arc.",
    "F5": "Engage the threat with the least time to the asset first.",
    "F6": "Give the executive order once the target is inside the gun's effective range.",
    "F7": "Cease fire when the target is destroyed; Hold fire at once when a friendly or civil aircraft enters the line of fire.",
    "F8": "After the engagement: Cease fire, then Unload; record the result of every target.",
    "L1": "Live fire: complete the gun's pre-firing checks before loading.",
    "L2": "Live fire: complete the range safety checks before RANGE CLEAR.",
    "L3": "Live fire: locate every unexploded round before declaring RANGE GREEN.",
    "V1": "Field drill: report every air contact quickly once it can be seen (or held on the gun's own radar or thermal sight).",
    "V2": "Field drill: identify each contact correctly (type, and hostile or not); say unknown rather than guess.",
    "V3": "Field drill: engage every hostile you identify; never fire on a friendly aircraft, a civil drone or a bird.",
    "U1": "UAV: complete the pre-flight checks before asking for take-off clearance.",
    "U2": "UAV: take off only with clearance from range control.",
    "U3": "UAV: stay inside the safe corridor and geofence.",
    "U4": "UAV: release only after CLEAR TO ENGAGE, with Master Arm switched on after the clearance.",
    "U5": "UAV: release accuracy, from the miss distance at impact.",
    "U6": "UAV: find and lock the right target quickly; never lock a civil object.",
    "U7": "UAV: report the battle damage assessment correctly.",
    "U8": "UAV: Master Arm back to SAFE straight after release.",
    "U9": "UAV: return along the inbound corridor, land, recover and clear the payload."
  },
  "confidence": [
    { "k": "likely",    "label": "Likely",    "p": 0.6,  "key": "Q" },
    { "k": "confident", "label": "Confident", "p": 0.8,  "key": "W" },
    { "k": "certain",   "label": "Certain",   "p": 0.95, "key": "E" }
  ],
  "detection": { "points": 30, "fullWithinSec": 3, "zeroAtSec": 20 },
  "identification": { "points": 30, "correctBase": 18, "correctPerConfidence": 12, "wrongPerUnconfidence": 10, "friendFoeBonus": 5 },
  "roe": {
    "tight": { "needsClearance": ["gun", "intc"], "clearanceSec": 4 },
    "peacetime": { "needsClearance": ["gun", "intc", "jam", "spoof"], "clearanceSec": 6 }
  },
  "defeat": {
    "points": 40,
    "preferred": { "rfLinked": "jam", "gnssOnly": "spoof", "autonomous": "intc" },
    "tables": {
      "rfLinked":   { "jam": 40, "intc": 30, "spoof": 30, "gun": 28 },
      "gnssOnly":   { "spoof": 40, "intc": 36, "gun": 26, "jam": 0 },
      "autonomous": { "intc": 40, "gun": 30, "jam": 0, "spoof": 0 }
    },
    "friendlyHold": 40, "friendlyEngaged": 0,
    "clutterHold": 40, "clutterEngaged": 10,
    "hostileHeldButNeutralised": 20,
    "civilHold": 40, "civilEngaged": 0,
    "modifiers": { "urbanGun": -15, "lateEngagementSec": 8, "late": -8, "priority": -5, "priorityRatio": 0.6, "missNotReengaged": -10, "unauthorised": -40, "ewRestricted": -10 }
  }
}
